id,post_id,parent_id,content,status,created_at,user_id
59976,110348,,創価3世です。生まれたときに入会しました。お付き合いする方が変わる度に言わないといけないのが正直大変なところはあります。大好きな両親、祖父母がやっていたことを全て否定したくもないし、父が毎日仏壇に向かい唱えている姿を当たり前で育ちました。私含め、両親はそこまで熱心には活動していませんが悪いことをしていると言う気持ちもないので、辞めると言う選択肢はありません。私は、結婚相手には勧誘するつもりもないし、もし結婚出来て子供が生まれたら、勝手に入会はしたくないなぁとも思います。今の彼氏にはまだ言えていないので、いつ言おうかと葛藤しています。創価2世、3世の方お気持ち分かる方多いのではないのかなぁと感じます。,approved,2025-08-06 09:32:24+00,
60059,120384,,厳しいな,approved,2025-06-21 22:24:40+00,2005
60070,105047,,"年代別男性の平均年収すら、分かって無いのか？
調べる事もせず答えてる人が殆どじゃね？

それと高年収の男は、年収基準を設けている女性を選びません。
寄生する気満々な女性は、高年収男性は見抜いてますよ
それだけ人を見る目がある面があるので、高年収になれているんですよ。",approved,2025-06-23 07:21:32+00,2007
60076,110348,,やっぱり結婚は無理だよね。自分が留守中に配偶者が子どもと黙って学会の人と会ってあるなんか疑ったら普通の生活が困難。,approved,2025-08-06 09:32:24+00,2010
60077,110348,,&gt;&gt;34 議論を歪めてる,approved,2025-08-06 09:32:24+00,2006
60080,110348,,最悪の偽宗教。,approved,2025-08-06 09:32:24+00,
60091,81181,,やっぱりという感じなんだけど,approved,2025-06-25 21:59:06+00,2004
60096,110348,,めちゃくちゃ集計の多いアンケートで、まさに世論ですね。,approved,2025-08-06 09:32:24+00,2003
60126,113028,,"彼氏…ではないですけど、うちは旦那がまさにフキハラ常習犯です。

会社に行きたくないのか、朝起きた瞬間から機嫌悪くて、旦那の顔色をうかがうのが、私の毎朝の習慣になってます。

たぶん、家族だから…と甘えているのでしょうね。
付き合ってたときは見抜けなかったな～。",approved,2025-12-15 01:03:20+00,2009
60127,113028,,"元カレがちょっとしたひと言で怒り出す人で大変でした。

デート中に職場の同僚（男）から電話がかかってきただけで、

『俺と、その男、どっちが大事なんだ？！」とかキレ始めて…。

当時は彼の好きだったから、
「ごめんね……」と謝りましたが、
今思えば「お前、子どもかよ」って感じ。

さっさと別れて正解でした。",approved,2025-12-15 01:03:20+00,2004
60128,113028,,"私は昔ものすごくわがままで、彼氏の前だとつい甘えて、すぐ不機嫌になるタイプでした。

でも元カレとデート中に不機嫌なふるまいをしたら、「自分の感情をコントロールできないと、結局損するのは自分だよ」と諭されたことがあって。

途端に自分の子どもっぽいふるまいが恥ずかしく思えてきて、行動を改めるようになりました。

今でも怒りや不機嫌さを制御できなくなる瞬間はあるけど、
そのたびに「自分が未熟な証拠」と言い聞かせるようにしたら、少しずつ感情をコントロールできるようになってきました。

過去の私のようにフキハラをする人って、いくら周りが働きかけても、本人が本気で変わらなきゃ…と思えるようなきっかけがない限り、なかなか変わらないと思います。

親しい仲にも礼儀あり、を忘れずにいたいですね。",approved,2025-12-15 01:03:20+00,2002
60153,113341,,0％、100％のどちらかって気も。,approved,2025-12-22 07:14:57+00,
60154,113341,,成功かどうかはわかりませんが、私は復縁後に結婚しました。,approved,2025-12-22 07:14:57+00,2010
60156,113341,,&gt;&gt;3 それってかなり珍しいのではいでしょうか？復縁してまた破局が圧倒的に多い気もします。,approved,2025-12-22 07:14:57+00,2001
60162,119870,,"多めに払って欲しいと考える人がこんなに多いなんて、、恥ずかしい笑
奢ってもらいたそうな感じの出てるケチな方に程奢りたくないって思いますね、、
逆にお金がなくても自分の分は払いますって考えの方には奢らせて欲しくもなります。",approved,2025-07-06 10:13:13+00,2007
60163,100233,,"一見彼氏がおかしいとしか思えない話ですが、こういう場合共感を得るためあまりフェアじゃない例を持ってくることが多いかと思ってしまいます。
彼氏ももちろん怪しいですが、何もなしに疑わないとも思います。彼なりの言い分があると思います。
改めて自分に何か要因がないか考えてみるのも良いかもしれません。
もしかしたらですがその上で良い関係が築けるかもしれません。",approved,2025-12-02 12:39:12+00,2003
60172,110460,,彼の言ったことに反論はするかもしれませんが、そのあとすぐに別れますね。相手が傷つくことを平気で口にするような人は、結局、自分に自信がないんですよ。常に自分の感情が優先なので、いざという時、あなたのことを守ってくれないと思いますよ。,approved,2025-08-08 18:58:18+00,2009
60173,110460,,"主さんには悪いけど、正直「面倒くさい男！」って思っちゃいました。
元カレと自分を比較してネチネチいう男って女々しいというか、器小さすぎ！！
どんなにイケメンでも、金持ちでも、付き合いたくない。
そういう男って、結婚して子どもが生まれても「俺と子どもどっちが大事なんだ」とか言ってきそう。私なら即別れます。",approved,2025-08-08 18:58:18+00,2005
60174,110460,,暴言を吐いても、恋人なら受け入れてくれるって甘えてるんじゃない？　暴言を吐くことで自分の支配下に置こうとしてるのかも,approved,2025-08-08 18:58:18+00,2009
60175,110460,,"彼に対して好きな気持ちが残っているなら、距離を置いて様子をみてもいいと思います。
メールも返信せず、しばらく放置。それでも暴言がやまないなら「好きな人に同じことをいわれたら、あなたはどう思う？」「こういうことを言われると傷つく」などと伝えて、冷静に考えさせますね",approved,2025-08-08 18:58:18+00,964
60177,83737,,ええ？たかが、不倫しただけで犯罪者扱いじゃない。,approved,2025-09-21 13:10:34+00,
60242,110474,,目黒区,approved,2025-08-11 01:25:21+00,2004
60245,109744,,私は一度目の結婚で不倫が見つかり離婚。独身になり現在既婚男性と不倫の仲になり、もう9年経過しました。すごく慎重に会ってデートをし、緊張感は忘れないようにしています。,approved,2025-07-18 21:31:58+00,2001
60248,109744,,"女の不倫はばれないって考えはもう古いのでは？
これだけ女の不倫増えてきているし、ネットや女性誌での托卵の仕方とかばれない不倫の仕方なんて特集やっているし。。
社会現象だよ。
女の不倫は。
警戒している男も増えているし、男の方がばれないように証拠積み立てるのはうまい。
そして時期が来たら逃げ道潰して徹底的にやるしね。
最近はＤＮＡ鑑定も認知されてきているし。
あまり男をなめるなよ？",approved,2025-07-19 18:54:57+00,964
60249,109744,,"&gt;&gt;22 最近は女の不倫が認知されてきているからね。
男も気を付けているよ？",approved,2025-07-19 18:57:01+00,2001
60250,109744,,"&gt;&gt;29 リスク高すぎるよね。
不倫するくらいなら結婚しなけりゃいい。
する奴は何度でもするししない人は一生しない。
裏切り行為だからね。
人間性疑うよ。",approved,2025-07-19 19:00:38+00,2007
60251,83560,,"不誠実だと思うし何故ワザワザするのか理解できん。
ばれたら全て失う可能性もあるしパートナーにも申し訳ない。自分がされたら絶対に嫌だし。
嫌なことはパートナーにもしない。
悲しませて失うこと考えたら絶対に出来ないよ。",approved,2025-09-18 06:12:57+00,2008
60252,83560,,"&gt;&gt;82 どっちも駄目。
男の不倫相手も不倫しているってことだし。
最近はダブル不倫って増えているし。",approved,2025-09-18 06:12:57+00,2005
60253,83560,,"&gt;&gt;71 離婚すれば良いと思うけどね。
それが出来ないってのは狡いし卑怯。&gt;&gt;61",approved,2025-09-18 06:12:57+00,2003
60254,83560,,&gt;&gt;6 体の関係ができた時点で不倫だよね。,approved,2025-09-18 06:12:57+00,964
60255,83560,,&gt;&gt;30 そんな友達は相手にしない方が良いに決まっている。そんな人と付き合いが有るだけで品性が疑われる。,approved,2025-09-18 06:12:57+00,2002
60256,83560,,"&gt;&gt;30 不倫した時点でその可能性は生まれる。
その事がわからないのか言い訳か。
綺麗事にしか聞こえないよ？",approved,2025-09-18 06:12:57+00,964
60257,109744,,"元主人は不倫旅行に出かけ宿泊先で心不全起こしなくなりました
警察で話しを聞き霊安室へ連れて行かれた時はもう軽蔑の目でしか見れませんでした",approved,2025-07-19 20:15:11+00,2002
60258,109744,,"旦那は浮気の常習犯。
現在も絶賛W不倫中です。
もちろん携帯をこっそりチェックして気付きました。旦那は証拠がないからバレていないと思っていますが、私は探偵さんに依頼しラブホの出入りの写真を2回分持っています。
後はどう勝負するかです。
しかし、女の旦那さんは全く不倫に気付いていません。早くバレればいいのに。",approved,2025-07-19 20:34:00+00,
60259,119688,,"&gt;&gt;8 
盗撮するようなやつ会う前から何かしら訳あり感出てるから分かるでしょw
みんなそんな危険な出会いばっかしてんの？",approved,2025-07-20 13:29:59+00,2007
60277,84123,,結婚願望があるか不明なら、ゆったりリラックスしてるときにふわっと結婚したいとか願望ってある？って聞いたらいいんじゃないかなと思います。お互いの意見交換出来ないうちから結婚に踏み切るのはリスキーだと思いました。,approved,2025-09-26 21:56:41+00,2009
60289,113341,,別れて１ヶ月後ぐらい、寂しさからすぐにアタックしました。相手からはLINEをブロックされ音信不通に・・・,approved,2025-12-22 07:14:57+00,2009
60290,113341,,1年間同棲していた彼と別れた後、半年でよりを戻したことがあります。でもうまくいかず、すぐに別れましたね。お互いの些細な言動が許せずに別れたのですが、復縁してもやっぱり合わないなと感じる点が多くて、喧嘩が絶えなかったです。,approved,2025-12-22 07:14:57+00,2006
60291,113341,,"別れた理由にもよると思うけど、性格の不一致とかはヨリを戻しても、また別れると思う。

私は、元彼に浮気されて別れたけど、どうしても彼のことが忘れられずに私からアプローチして復縁したことがあります。でも結局、３ヶ月も経たないうちにまた彼の浮気が発覚。人ってそう簡単に変わりません。",approved,2025-12-22 07:14:57+00,964
60301,113341,,7年後に復縁、来年結婚します。,approved,2025-12-22 07:14:57+00,2005
61527,111624,,"断然「爆乳」がいい！
美人や美脚なんて、道を歩けばそこそこ見かけますが、
Gカップ以上の爆乳なんて、１００人に1人いるかいないかくらい稀少です。
「胸のデカい娘は七難隠す」ってね。羨ましい限り。",approved,2025-09-30 00:10:10+00,2008
61528,111624,,"巨乳は年取ると垂れる？
貧乳でも経産女性は垂れるよ。知ってました？皮膚がたるむというか‥
そりゃ巨乳ちゃんはデカいのだから垂れて当然。貧乳の垂れより、見事な垂れ具合。
乳輪もデカくて当然。良好なバランスです。
Ｔｈｉｓ　ｉｓ　エロチックです！",approved,2025-09-30 00:10:10+00,964
61529,111624,,"&gt;&gt;12 巨乳は年取ると垂れる？
貧乳でも経産女性は垂れるよ。知ってました？皮膚がたるむというか‥
そりゃ巨乳ちゃんはデカいのだから垂れて当然。貧乳の垂れより、見事な垂れ具合。",approved,2025-09-30 00:10:10+00,964
62461,110348,,無理。価値観も違うし、どうしたってお互い分かり合えないから夫婦になるのは難しい。家に謎の仏壇を置かれるとか怖すぎる。心の中で信じるのは自由だけど、結婚となると色々なことを共有していかないといけないから、厳しいと思います。,approved,2025-09-09 14:52:52+00,2009
62462,110348,,無理。価値観も違うし、どうしたってお互い分かり合えないから夫婦になるのは難しい。家に謎の仏壇を置かれるとか怖すぎる。心の中で信じるのは自由だけど、結婚となると色々なことを共有していかないといけないから、厳しいと思います。,approved,2025-09-09 14:53:05+00,2008
66352,119870,,"デートだけでなく、男の付き合いでも言われたことありますが、収入が多い方が奢る？？
収入が多いのはそれまでの自分の努力であり、収入が少ないのは努力が足りないからと考えます。
""奢って貰う""負け犬思考だから収入もすくないのではないかな？
そもデートに収入持ち出すのはどうでしょうか。
自分の食べたものくらい自分で払えない人がデートする資格はないと考えます。",approved,2025-09-29 11:02:36+00,
68008,100748,,"Best Nude Playmates &amp; Centerfolds, Beautiful galleries daily updates
http://big.tits.napavine.gigixo.com/?jailyn 
 lindsay lohan jail porn photos of porn stars of 70s sexy ebony porn videos free nude porn girls young sex angelina jolie porn fakes",approved,2025-12-01 08:27:09+00,2003
69145,105047,,&gt;&gt;5 てことはお前200？ド底辺じゃんwww,approved,2025-12-09 22:41:13+00,
69733,119870,,Toronto,approved,2025-12-20 04:51:30+00,
70188,100748,,"学生です！
もうすぐで3年経ちますが現在進行形です。
最後に会ってから2年経つけれども、、orz",approved,2025-12-23 17:27:58+00,
70226,113341,,"お互い忘れた頃に偶然再会したような復縁なら上手くいきそう
どちらかに少しでも未練が残ってたら上手く行かない",approved,2025-12-25 12:55:38+00,2007
70262,110348,,難しい問題だね,approved,2025-12-29 01:38:49+00,2002
70265,100748,,"Big Ass Photos - Free Huge Butt Porn, Big Booty Pics
http://matureporncams.peepornpics.xblognetwork.com/?noemi 

 gay porn blue mountains galleries eva angeline porn euopean porn free leah luv porn superheroine sourcerer porn",approved,2025-12-29 07:33:35+00,2003
70452,83574,,ポケットに手を入れるのは失礼だからベルトに手が行くと言われました。,approved,2025-09-18 12:55:22+00,964
70521,110348,,私も創価学会の方と結婚を前提に三年お付き合いしていましたが婚約するとやはり入信を求められ子供が産まれた際は迷わず入信させる。と言われてしまった為別れる事になりました。大好きな方でしたが家族も巻き込む問題なので諦めました。価値観などを考えた時にやはり創価は創価の方同士で結婚することが一番の解決策だと思います。一般人にはなかなか刷り込みによる洗脳から理解し難い部分がありすぎて戸惑います。,approved,2025-08-06 09:32:24+00,
70610,110348,,いくつかのカップル見ていて、子どもの教育で揉めて離婚するケース多いです,approved,2025-08-06 09:32:24+00,2010
70846,110532,,細かく聞いてみたいけど,approved,2025-08-17 00:29:41+00,2008
71644,109095,,すると思います,approved,2025-07-08 00:05:13+00,2002
71910,82876,,"別れたときは悲しかったけど、結婚していたら今頃介護問題で大変だっただろうなぁ。
9歳上くらいなら全然有りだと思います。",approved,2025-09-07 09:49:26+00,2001
71927,82876,,12歳下でも気になりませんでした。,approved,2025-09-07 09:49:26+00,2005
71938,110492,,お金が無いと何も出来ないですからお金だと思います。,approved,2025-08-12 03:27:23+00,2009
71943,110492,,"お金と自分自身と自分の時間かなと思います。
お金は確かに大事ですが、自分自身を見失わない生活をしたいです。",approved,2025-08-12 03:27:23+00,2005
71946,111512,,普通にあります。第一印象が違ったり、こっちが良くても向こうがそこまでだったり、色々です。,approved,2025-09-14 12:55:21+00,2002
71949,102357,,年下でも、男性に少しでも多めに出して貰った方が立場的に良いと思います。,approved,2025-02-11 10:43:26+00,2010
72042,107571,,お父さんには言えてません,approved,2025-06-18 02:19:04+00,2004
72047,110492,,無一文で出来ることがほぼ無いからね,approved,2025-08-12 03:27:23+00,2004
72052,110492,,頼れるのは自分しかいません。こうなったら早くあの世に行った方が楽かな。と思う時もあります。,approved,2025-08-12 03:27:23+00,
72067,102357,,お金に関しては完全に割り勘がいい,approved,2025-02-11 12:12:21+00,2003
72068,102357,,割り勘しかしたことないし、それでいいと思ってます,approved,2025-02-11 12:13:44+00,
72069,111512,,一日一緒にいて面白くなかったらもう会いません。,approved,2025-09-14 12:55:21+00,
72071,110492,,やはり「お金」であろう。お金があれば贅沢でなくても生活は出来る。そして細々生活していれば何か生き甲斐を見つけることも出来るかもしれない。,approved,2025-08-12 03:27:23+00,
72095,102072,,特別な日だけでいいという意見がちらほらあるけど、初デートは特別な日では…？,approved,2025-02-11 13:16:22+00,2009
72106,110344,,"&gt;&gt;3 私もB型ですが、同じです…！
同じB型の前夫とは3年で破綻。O型の彼が一番居心地良かったです。
今の夫はA型で、仲は良いですが「細かいなぁ」と思うこともしばしばです。",approved,2025-08-06 09:21:14+00,2010
72111,111586,,"29で離婚して、再婚したくて婚活したけど、年齢でだいぶ弾かれてるなというのはヒシヒシ感じた。もちろんバツイチなのもあるけど、それだけじゃなかった。
それにしてもアンケートの年齢の区切り方が絶妙。",approved,2025-09-24 02:08:05+00,2003
72162,110344,,血液型で、人間の人格に影響があると考えるのは日本人特有のものですね。人間ていうのはそんなに簡単にタイプ分けされるものではありませんね。,approved,2025-08-06 09:21:14+00,2010
72163,110172,,女性からプロポーズしてもらえるなんてこれほど嬉しいことはないと思うので。人から愛されることがこれほど感動的なことなのか！ということを是非とも味わいたい。,approved,2025-07-28 02:54:59+00,2002
72164,110344,,人間の性格と言うものはもっと複雑なものだと思います。血液型よりも、遺伝や、後天的な生活環境の影響で形成されることの方が有力だと思います。,approved,2025-08-06 09:21:14+00,2001
72171,110492,,最近、お金が無くて追い詰められた高齢者による犯罪が増えているように思うので……。,approved,2025-08-12 03:27:23+00,2007
72178,110492,,結局はお金しかないと思うな。,approved,2025-08-12 03:27:23+00,2007
72179,110959,,あんまり好きじゃないかな。なんか筋肉自慢みたいで。,approved,2025-08-26 02:12:45+00,2005
72181,83588,,的はずれなプレゼントは貰ったことがない。,approved,2025-09-19 01:55:16+00,964
72184,107571,,普通に言います。珍しくないと思うし。,approved,2025-06-18 02:19:04+00,
72235,110492,,"とにかくお金。
お金がないと生きていけない。",approved,2025-08-12 03:27:23+00,964
72251,110959,,"好きじゃないです。
避けます。",approved,2025-08-26 02:12:45+00,2009
72325,109095,,結婚していると、いろいろある。それも受け入れています。,approved,2025-07-08 00:05:13+00,964
72326,109095,,結婚とは、良いも悪いもお互いを許し会うことではないでしょうか。,approved,2025-07-08 00:05:13+00,964
72327,109095,,結婚とは、振り返ったときに幸せだと思えればいいのでは。,approved,2025-07-08 00:05:13+00,2010
72331,110959,,なぜだか理由は分かりませんが、袖が付いていて欲しいですね。,approved,2025-08-26 02:12:45+00,2003
72332,102072,,年齢にもよりますけどね。学生だったらいいと思います。,approved,2025-02-11 18:09:36+00,2005
72333,102072,,安くて美味しくてたくさん食べれるのでいいと思いますよ。,approved,2025-02-11 18:10:53+00,2009
72383,110959,,まさかタンクトップだけ？時と場合によるねｗ,approved,2025-08-26 02:12:45+00,2007
72422,109095,,トイレを共有したくない。別居婚ならありかも。,approved,2025-07-08 00:05:13+00,2010
72431,110492,,お金が無ければ、何もできないし、他の人も振り向いてくれない,approved,2025-08-12 03:27:23+00,2003
72432,83588,,考えた上でくれたと思うので、それが何があっても関係無い,approved,2025-09-19 01:55:16+00,2007
72443,110959,,タンクトップで外に出るのはなしです。,approved,2025-08-26 02:12:45+00,2006
72445,110492,,お金があればホテルのような有料老人ホームに入れるし。心の寂しさはあるかもしれないけど生活には困らないはず。,approved,2025-08-12 03:27:23+00,
72446,110492,,お金があれば心の寂しさはあるかもしれないけど生活には困らないはず。,approved,2025-08-12 03:27:23+00,2003
72449,102072,,あまりに気取ってる店よりも逆に好印象かもです。,approved,2025-02-12 20:51:39+00,2009
72452,109065,,言いづらいけど言います。,approved,2025-07-07 16:46:17+00,2007
72454,84184,,好きになってくれても好きじゃない人とは付き合えないので私は好きになった人かなぁと思います。,approved,2025-09-29 16:39:58+00,2003
72458,119870,,彼の年齢が分からないですが、年収800万って結構な地位にいないともらえないと思います。ただ時と場合によっては割り勘や支払い負担してもいいかなって思います。,approved,2025-04-14 02:11:16+00,
72463,110959,,特に問題ないと思います！,approved,2025-08-26 02:12:45+00,964
72465,109095,,お金に関する価値観が根本から違うので、話が通じないのが苦痛です。,approved,2025-07-08 00:05:13+00,
72472,110492,,間違いなくお金でしょう。お金があれば大抵のことはなんとかなります。,approved,2025-08-12 03:27:23+00,2006
72474,110959,,タンクトップの男性とは、多分内面的にも合わなさそうと思うので。,approved,2025-08-26 02:12:45+00,964
72477,119870,,"初デートくらいは全額奢りであってほしいですね。
付き合いが長くなれば、ずっと男性側のおごりというわけにもいかないと思いますが・・・。
この彼氏さんからは、金銭にシビアというよりは、彼女さんへの思いやりや優しさがあまり感じられませんでした。
もし、将来結婚することになっても何らかの苦労をしそうです。",approved,2025-04-14 02:11:16+00,2010
72478,102072,,"サイゼリヤ自体が嫌いなわけじゃないけど、社会人の初デートでというのが引っかかります。
誘った相手を楽しませようという工夫とか、特別感が感じられないので。",approved,2025-02-12 22:45:15+00,2002
72481,110415,,旦那は体形変わらないのに、私は３㎏ほど増えました。,approved,2025-08-07 06:05:40+00,2008
72484,109065,,"彼氏なら伝えた方がいいと思う。優しさベースで。
外出先で他人に見られ続けるのもどうかと思うし。",approved,2025-07-07 16:46:17+00,2004
72485,109065,,お笑いのノリで言ったら場が和むかもしれませんよね〜,approved,2025-07-07 16:46:17+00,2010
72486,110415,,太る人が多いと思います！少し減らせると良いのですが、、ついつい誘惑に負けてしまいます（涙）,approved,2025-08-07 06:05:40+00,2006
72507,110492,,お金があれば独身貴族として生きていける,approved,2025-08-12 03:27:23+00,2003
