id,post_id,parent_id,content,status,created_at,user_id
2825,81181,,"私だったら、許さないし、ひたすら止めます！
その状況で男性を信じる方が無理です。",approved,2025-07-03 16:28:49+00,2001
2827,81181,,"&gt;&gt;2
コメありがとうございます！
ですよね！
田舎あるあるなんでしょうか。",approved,2025-07-03 22:43:52+00,2009
2828,81181,,"不安ですね、、、。
でも付き合いならばしょうがないところもありますよね。なかなか断りづらいところもあると思います。
彼には不安なこと、ちゃんと伝えましたか？
彼の反応も気になるところです。
｢俺は誘われたら行くよ｣って言われちゃうとまた心配ですが、もし｢大丈夫、断るよ｣って言ってくれるなら、その言葉を信じてみるしかないかもしれませんね。
心配ですが頑張ってください😢",approved,2025-07-04 11:02:47+00,2010
2843,81181,,"&gt;&gt;4 
返信ありがとうございます！
ただの旅行だしそんなところは行かないよっていう反応でした。
その言葉を物理的に信じられるようにしてほしいです。
例えば15分おきに連絡くれるとか、GPSつけるとか...(笑)そんなの無理なので悩めるところです。",approved,2025-07-04 21:10:36+00,
2853,81181,,"正直に消防団の人と旅行に行くと言ってるんだから、その先散策する必要ないんじゃない？
結婚してもお互い未知の部分はあって然るべきです。それがない関係なら、束縛しているからに他なりません。",approved,2025-07-05 00:23:45+00,
2869,81181,,"&gt;&gt;6 
コメありがとうございます。
浮気も不倫もバレなければ許せるタイプですか？",approved,2025-07-05 21:59:55+00,2003
2873,81181,,"&gt;&gt;7
バレていない時点で許すも何もないですね。まだ起きていないことにあれこれ許す許さないと悩むことは時間の浪費かと思っているだけです。",approved,2025-07-06 02:25:36+00,2003
2877,81181,,"&gt;&gt;8 
風俗に行っていたら100％証拠を見つける自信があるのですが、もし旅行先で風俗に行っていたことを知ったらどうされますか？",approved,2025-07-06 11:14:03+00,2005
2878,81181,,"&gt;&gt;9 
知ったら怒りますが、知らないうちは何も怒りや不安の感情は起こりません。",approved,2025-07-06 12:26:13+00,
2882,81181,,"&gt;&gt;10 
そうなのですね！
予防などもされませんか？",approved,2025-07-06 16:24:26+00,2010
2883,81181,,"&gt;&gt;11 
予防とは相手を旦那に遊ばせない防御という意味でしょうか？
そうであれば、別に旅行でなくて日常で遊ぶことはいくらでもできると思いますので、いちいち考えたらキリがないですね。",approved,2025-07-06 18:00:45+00,964
2886,81181,,"&gt;&gt;12 
分かりました！
ありがとうございました(&gt;_&lt;)",approved,2025-07-07 07:58:54+00,2007
2911,81181,,">>13 
消防さんにはぜひ幸せになって欲しいと思います。信じる方法の信じる対象は、自分しかないと私は思っています。",approved,2025-07-09 13:54:54+00,2003
2957,81181,,"&gt;&gt;14 
ありがとうございます。
信じきって裏切られた時に
傷つくのが怖いのだと思います。
でも信じてみます！",approved,2025-07-11 20:20:00+00,
2965,81181,,"&gt;&gt;15 
何の根拠もなく信じても最後は不幸になるだけですよ。大丈夫ですか？
浮気防止の万策を尽すことで自分に対する自信が生まれるのかと。だからまずは徹底した努力が大事。",approved,2025-07-12 01:24:00+00,2003
2982,81181,,"&gt;&gt;16 
そうですよね。
例えば16さんならどんな努力をされますか？",approved,2025-07-12 19:07:43+00,2010
3321,81181,,"男は、全然好きじゃない人とHできてしまいます。
だから風俗店が成り立っています。
身体の接触があるから、風俗に行ってほしくないのかな？
ならば、もう彼にお願いして「風俗に行ってもいいけど、オナるだけで我慢して」と言いましょう。これなら接触しなくて済みます。AV見てるのとかわりません。
ひとり作業です。団員どうしのお付き合いにも参加できます。

わたし個人の意見としては、キャバクラの方が不潔だと思います。
こっちは、「心」と「身体」と「お金」を商売にしています。
彼の心とお金を狙ってくるのが、キャバクラです。
キャバクラが許せるのなら、風俗なんて全然安心だと思います。

心のない風俗、心を狙うキャバクラ。
ちんちんの浮気か、心の浮気か。

どっちも許せないとは思います。思いますが、
彼を信じて、どっちかを許してあげるとしたら・・・・
どっちを選びますか。",approved,2025-08-02 18:22:46+00,2009
53550,110348,,"旦那もその親戚一同も皆創価学会で、私の親族側は1人も居ませんが結婚しました。
毎日すごく幸せですよ。世界一の旦那さんです。
私が入りたいと思えば入ればいいと入会を強制させられた事はありませんし、とっても温かい家族で、嫁姑問題なんて皆無です。誰かの愚痴を聞いた事もありません。私の祖父母は創価学会が大嫌いなので、この先ずっと、旦那が学会員という事を伝えるつもりはありませんが、祖父母は常々『本当に優しい人だね。こんないい旦那さんは他にいないよ』と言っています笑
創価学会の人、そうでない人、で考えるのではなく、その人自身が自分に合う人がどうかで考えるべきだと思います。
批判している方のほとんどは学会の本質や実態を知らないと思います。本なども沢山出版されていますので、まずご自身で創価学会のことを知られるとよいと思います。",approved,2025-09-24 00:51:27+00,2008
170996,2,170990,ありがとうございます。もう少し具体的に回答をください,approved,2026-02-16 09:46:15.712+00,1010
170997,2,170996,"はい。了解しました。

私も全く同じ経験をしました！結論から言うと、2回目に進んで正解でした。

私の場合、マッチングアプリで知り合った彼と初めて会ったとき、「すごく良い人だけど、ドキドキしないな…」って正直思ってました。会話も楽しいし、優しいし、でも恋愛対象として見れるかと言われると、うーん…という感じで。

でも、彼から「また会いたい」と言われて、断る理由もないし、とりあえず2回目も会ってみることにしたんです。

そしたら、2回目のデートで少し見方が変わりました。1回目は緊張していたのか、お互い探り探りだったんですが、2回目は少しリラックスして話せて、彼の別の一面が見えたんです。趣味の話で盛り上がったり、笑いのツボが合ったり、「あ、この人といると楽しいかも」って思えるようになりました。

3回目のデートでは、彼が私の好きな場所に連れて行ってくれて、そのときに「この人、ちゃんと私のこと考えてくれてるんだな」って感じて、だんだん好きになっていきました。

今では付き合って1年以上経ちますが、最初の「ドキドキ」がなかったことは全然気にならないです。むしろ、ゆっくり好きになっていったからこそ、安心感があって、長く続いているのかなって思います。


**私からのアドバイス**

1. **最低3回は会ってみる**
1回目は「お互いを知る」段階なので、恋愛感情が芽生えなくても当然です。2回目、3回目と会ううちに、相手の魅力が見えてくることも多いです。

2. **「キュン」がすべてじゃない**
一目惚れのようなドキドキも素敵ですが、それだけが恋愛じゃないと思います。一緒にいて楽しい、安心できる、価値観が合う…そういう「居心地の良さ」も、とても大切な恋愛の要素です。

3. **自分の気持ちを確かめる期間を作る**
2回目、3回目のデートで、「この人ともっと一緒にいたい」と思えるか、「会うのが楽しみ」と思えるか、自分の気持ちを確かめてみてください。それでもピンとこなければ、そのときに判断すればいいと思います。


**逆に、こんな場合は見切りをつけてもOK**

- 会話が全く弾まない、沈黙が苦痛
- 価値観が合わない（お金の使い方、デートの過ごし方など）
- 生理的に無理（清潔感がない、マナーが悪いなど）
- 2回目に誘われても「会いたくない」と思う

あなたの場合、「すごく良い人」と思えているなら、まだ可能性はあると思います。2回目、3回目と会ってみて、それでも恋愛感情が芽生えなければ、そのときに「友達として」とお断りすればいいんじゃないでしょうか。

焦らず、自分の気持ちを大切にしてくださいね。応援しています！",approved,2026-02-17 03:59:38.328+00,2007
3029,81181,,"消防団の旅行でそういうお店に行くことを、彼から打ち明けられたのでしょうか？
その時、あなたはそういうことをしないでとお願いしたのであれば、まずは彼を信じるしかないと思います。
それでもそういうことをしたことがあるとわかれば、嘘をついたことになるので、別れた方が良いと思います。",approved,2025-07-15 08:22:31+00,
3033,81181,,"&gt;&gt;18 
彼から打ち明けられたわけではありません。
消防＝風俗はつきものというのは
常識みたいな感じです💦",approved,2025-07-15 13:54:10+00,2002
3040,81181,,"男の立場から推測しますが、消防＝風俗を因数分解するとこうしたことが言えるのではないでしょうか？

消防団は身体的な自信があり、比較的男性ホルモンが多い男性が集まる→性欲が強い
消防団は人とのつながり、付き合いを大事にする人が多い男性が集まる→集団心理に流されやすい
消防団は歴史が長く、先輩代々から受け継いだ風土習慣がある→旅の恥も武勇伝を作る機会の一つだと思っている

消防団向けの旅行代理店もあるようですね。

こうしたことを推察すると、消防団に入る男性はとても人に優しくて男性としては頼りがいある方なのではないでしょうか？そうした良いとこをみてご結婚されたわけですから、あまりとやかく言わないで放っておくことはできませんか？",approved,2025-07-16 10:24:35+00,2001
3065,81181,,"&gt;&gt;20 
分析ありがとうございます(笑)
でもどう理解したら優しくて頼りがいがある人とつながるのか分かりました💦(笑)",approved,2025-07-16 22:29:01+00,2001
3066,81181,,↑分かりません、です💦,approved,2025-07-16 22:29:32+00,2010
3277,81181,,"&gt;&gt;30 
福岡か熊本です。
風俗レベル過激県が候補の時点で不安ですよね。",approved,2025-07-31 06:39:03+00,2001
3278,81181,,"&gt;&gt;31 
お願いしても行くとなった場合別れるしかないでしょうか。",approved,2025-07-31 06:40:02+00,2001
3279,81181,,"&gt;&gt;32 
旅行のお金は分団から出るので自分の財布は痛みません。地域の税金がこうして使われているのです。",approved,2025-07-31 06:41:32+00,2007
8651,83588,,お菓子の詰め合わせをもらったことがありますが、私は子供か！！と思いました。,approved,2025-09-20 13:25:44+00,2007
3129,81181,,"まず根本的に消防団は消防士ではありません。
一般の方々がボランティアでやっているのが消防団です。
筆記試験があるわけでもなければ体力試験もありません。
希望すれば全ての人が入れます。
ですので、太ってる方もいれば体力がない方もいます。

消防団の旅行なのであれば、一般の会社の人達が旅行にいってるだけの話です。
消防はなにも関係ありません。
消防団の旅行は風俗がつきものと言うのであれば、男の旅行全てそうです。",approved,2025-07-19 01:37:43+00,2009
3151,81181,,"&gt;&gt;23 
消防団の人ですか？あまり実態をわかってないようですね。
私は以前消防団に入ってましたが、体育会系なノリについていけず、5年前にやめました。

消防団は体育会系の集まりなので、一般の会社なんかとぜんぜんノリが違うのよ。
そりゃあ、男たけの世界だから女の話は大好きたし、風俗やキャバクラなんかも行くのは当然です。
それ以上に上下関係がきつくて、先輩の命令には従わないといけないし、精神的、金銭的にも辛かったので辞めました。",approved,2025-07-20 03:38:50+00,2008
3154,81181,,"&gt;&gt;23 
男同士の旅行全てに心配がついてくるのは分かります。中でも消防の旅行はたちが悪いというか...",approved,2025-07-20 10:42:15+00,2009
3155,81181,,"&gt;&gt;24 
上下関係に加えて地域のつきあいとか、メンツとかもありますよね..つきあいがあると言われたら妻の立場からはそれ以上何も言えないです💦
うまくやめられたこと、消防団の大事な役割や大変さに誤魔化されず、異常な面に気づけた感性をお持ちでうらやましいです。",approved,2025-07-20 10:46:15+00,2006
3209,81181,,"&gt;&gt;26 
まだトピ主さんは根本解決していないように見えますが、今後どうされますか？独身で消防団に入ってるとはかなり地元愛が強い方に思えますね。

男は、独身の時はたくさん女遊びして、結婚したら消防団に入って、こっそり遊ぶイメージですが。",approved,2025-07-25 09:21:59+00,2006
3212,81181,,"&gt;&gt;20 
こんな専門サイトあるんだね。
http://www.shobodan.com/",approved,2025-07-25 12:00:26+00,
3214,81181,,"&gt;&gt;28 
こんな感じのもあるやね。
https://companion-party.com/index.php/page/fire-company",approved,2025-07-25 15:20:55+00,2004
3215,81181,,"こっちのほうがエグいね。

https://companion-party.com/",approved,2025-07-25 15:22:35+00,
3234,81181,,"残念ながら消防団の旅行とは基本ご想像通りです。
おそらく地域せいではございません。
おそらく今回の旅行先は有名な大きな繁華街の近くではないでしょうか。
居酒屋、キャバクラ、おぱいパブ、ピンサロ、〆のデリヘル、コレが本来の目的です。",approved,2025-07-26 11:33:02+00,2010
3238,81181,,やはり彼氏さんに消防団自体に参加しないことお願いするしかないですね。,approved,2025-07-26 14:15:27+00,2010
3242,81181,,"&gt;&gt;30 
財布が持たないなあ。遊びたいなら、ふつうに1人で風俗やキャバクラ行ったほうが安上がりだよね。",approved,2025-07-27 07:13:18+00,2006
3276,81181,,"&gt;&gt;29 &gt;&gt;28 
糞の集まりですよね😨
嫁や彼女がいてもこういうところを利用するなんてあほかと、、、",approved,2025-07-31 06:37:25+00,
55297,112360,,"そのお友達は1番好きな人を見ているというよりもその好きな人に対して作り上げたご自身の理想の相手を見ているのかな？と思った。
そしてお友達は完璧主義っぽい一面があるからこそ、その人の現実を見た時にこんな面もあるんだなーじゃなくて理想とのギャップを受け止めきれなくてダメージを負うんだろうなとも。
人に対して過度な期待をするとガッカリしちゃうって人は多分1番好きな人じゃなくても結婚したらその相手に期待し過ぎてガッカリすると思う。
でも2番目に好きな人だったら自分も妥協してるし頑張り過ぎなくてもいいって、(そのお友達の本意はそうじゃないかもしれませんが私はそう捉えました)それを旦那さんが知っていて結婚しているなら良いだろうけど、もし知らなかったのなら失礼な話だなとも思いました。

私は人生で1番好きな人が夫だけど異性としてだけでなく人としても尊敬しているから幸せです。",approved,2025-11-17 18:15:39+00,2006
170988,1,,"すごく分かります！私も以前、同じような状況で職場の先輩に片思いしていました。結果的に今はその先輩と付き合っているので、私の経験をお伝えしますね。

まず、焦らないことが大切です。
職場恋愛は、気まずくなったら毎日顔を合わせなきゃいけないので、慎重になるのは当然です。でも、だからこそ、じっくり距離を縮めていくチャンスでもあるんです。

私が実践したアプローチ方法を3つご紹介します：

1. 「相談」という名目で二人きりの時間を作る
仕事の相談でも、ランチのお店の相談でも、何でもいいんです。「先輩、ちょっと相談があるんですけど、今度お時間いただけませんか？」と声をかけてみてください。
私は「異動の相談」という名目で、ランチに誘いました。仕事の話から入れば、先輩も断りにくいですし、自然に二人きりになれます。

2. 小さな「特別扱い」を積み重ねる
先輩が好きなコーヒーを差し入れしたり、「先輩だけに」という感じで情報を共有したり、小さな特別扱いを積み重ねていきました。
「先輩、いつもお世話になってるので」と言って、たまにコンビニスイーツを渡すだけでも、相手は「自分のことを気にかけてくれてるんだな」と意識し始めます。

3. LINEで距離を縮める
仕事の連絡をLINEでするようになったら、たまに仕事以外の話題も振ってみてください。
「今日のランチ、美味しかったですね！」とか、「お疲れ様です、今日も残業ですか？」とか、軽い話題から始めて、少しずつプライベートな話もできるようになりました。

そして、一番大事なのは「脈ありサイン」を見逃さないこと。
先輩が「無理しないでね」と声をかけてくれたり、さりげなく手伝ってくれたりするのは、少なくとも好意的に思われている証拠です。
もし全く興味がなかったら、そこまで気にかけてくれないと思います。

告白のタイミングについて：
私の場合、3ヶ月くらいかけて距離を縮めて、二人で飲みに行けるようになってから告白しました。
職場恋愛は、「付き合う前にある程度お互いの気持ちを確認しておく」ことが大切だと思います。いきなり告白するより、「最近、先輩のこと気になってるんですよね」みたいに、少しずつ気持ちを匂わせていくのもアリです。

最後に：
もし先輩が本当にモテる人なら、ライバルもいるかもしれません。でも、あなたには「毎日顔を合わせる」という最大の武器があります。
焦らず、でも確実に、少しずつ距離を縮めていってください。応援しています！",approved,2026-02-16 12:00:01+00,2010
3283,81181,,"&gt;&gt;35 
じゃあ、どうしても事情があって旅行に参加できない団員さんには現金なりの支給はないのですか？ないなら不公平ですよね。",approved,2025-07-31 07:27:38+00,2004
3288,81181,,"&gt;&gt;36 
分団なりのルールは様々だと思いますが
良心的な分団は、各自報酬は個人にいく場合、旅行は自分の身出し。当然風俗も。でも風俗に行きたいが口止めもしなければということで、年配の人が後輩の分もお金を出して連れていくということもあるようです。赤信号みんなでわたれば怖くない的な、、。

さらに、報酬は個人にいかず分団が預かるという名目で各種慰労会、旅行、飲み、風俗にあてられ参加できない人は残念ながら、、、というところが多いようです。",approved,2025-07-31 21:12:05+00,
170989,1,170988,ありがとうございました。ベストアンサーにさせていただきました。,approved,2026-02-16 12:00:01+00,2005
3289,81181,,"そうやってある種の秘密を共有することも、結束？につながるのだと思います。 

表向きは仕事で忙しい中訓練を頑張り、操法の結果に一喜一憂を共にし、家事があれば力を合わせて消火活動をする中で、結束力、地域でのつきあいや仲間意識が高まるんでしょうが、、、
まだまだ奥さん彼女らが知らないことも多々やっています。
消防に限らず風俗に行く人の気が知れませんけどね。
働く人も働く方で、よく知りもしない人とセックスなんて金もらってもお断りですけど💦",approved,2025-07-31 21:19:15+00,2005
3304,81181,,トピ主さんは心辛いでしようね。彼に消防団を辞めるように説得されますか？,approved,2025-08-01 19:29:36+00,2004
3306,81181,,"&gt;&gt;38 
消防に気持ちよく送り出している奥さんとかを見ると知ってんのか？と思います。",approved,2025-08-01 21:57:08+00,2009
3307,81181,,"&gt;&gt;39 
GPSをつければ許せるかも、、、
でもGPSも誤魔化されたりするんですかね？",approved,2025-08-01 21:57:54+00,2006
3313,81181,,"&gt;&gt;41 
えっ？それ納得いきますか？",approved,2025-08-01 23:27:12+00,2007
3315,81181,,"&gt;&gt;42 
それは納得いかないでしょう。もっと本人の気持ちを察してみんなでベストな回答を考えないと。",approved,2025-08-02 01:57:41+00,2010
3316,81181,,最終的には消防さんの彼に対する強い想いがあるかどうかになるかと思われます,approved,2025-08-02 03:14:55+00,
3324,81181,,"&gt;&gt;42 
納得というか、信用できるかと思います。",approved,2025-08-02 19:57:45+00,2008
3325,81181,,"&gt;&gt;44 
強い思いはあっても
浮気されれば愛情はなくなります。",approved,2025-08-02 19:58:30+00,2006
3589,82384,,"今ある借金をうまいこと隠されて結婚できても、新たに住宅購入などでローンを組む場合に審査が通らず、明るみに出る可能性はないでしょうか。
心配です。",approved,2025-08-21 18:24:14+00,2005
