id,post_id,parent_id,content,status,created_at,user_id
28107,83726,,"浮気してる奥さんと面識あってたまたまひとりのときに見かけたら「この前⚫︎⚫︎で見かけましたよー」とかカマかけてみたら？
あくまで浮気とは知らないテイで。
旦那さんには言えない",approved,2025-09-21 01:35:48+00,2001
28109,83726,,変なことに巻き込まれたくないから伝えないです。,approved,2025-09-21 01:35:48+00,
28113,104788,,付き合ってるならすぐで全然問題ないと思う。,approved,2025-05-11 23:43:30+00,2005
28115,84635,,"そのまま使ったり保存しておきます。
いつか新しい彼氏ができて
久々にそのアクセサリー見たら捨てたくなる日が来ます。",approved,2025-10-08 21:13:22+00,
28117,84635,,気に入ってるならそのまま使っちゃいます！,approved,2025-10-08 21:13:22+00,2006
28119,104809,,ある程度のお金と優しさですね。,approved,2025-05-11 23:47:27+00,2008
28140,84152,,どろっどろですね。そんなこと本当にあるんですね。,approved,2025-09-27 05:09:04+00,2007
28143,83203,,"家事はまずは自分がやることって意識は必要なのでは？専業でしょう？それで衣食住保証されてるんだし
その上で申し訳ない手が回らなくて手伝ってくださいが筋でしょう
手伝ってもらって当たり前、協力して当たり前という人もいますが、果たして旦那さんの仕事に関して手伝えることがあるんでしょうか
一方的な要求に聞こえます",approved,2025-09-11 01:42:12+00,2009
28150,105154,,最初は妥協して結婚したけど、やっぱり妥協すべきでなかったのは？と聞かれたら、素直に年収と回答しまう。,approved,2025-05-12 19:10:56+00,
28151,105154,,"結婚と妥協という言葉が非常にひっかかりますが。

個人的に結婚はゴールではないので、どんなに外見が良い人でも加齢からは逃げられませんし、どんなに年収が高くても絶対に収入が下がらない保証はなく、安定した仕事でも激務で鬱病を患う可能性もあります。
長い人生、ホントに沢山の事があります。
それを一緒に乗り越えたいと思えるか、相手を支える立場になってでも一緒に暮らしていきたいと思えるかどうかが大切なのではないかなぁ？と思います。私の夫は11歳年上なので、介護して最期を看取る覚悟です。大切な人を残すことなく、悲しい思いをさせずに生きていけるならこの上ない喜びです。",approved,2025-05-12 19:19:57+00,
28152,105154,,自分の身長が160cmなので理想は175cm以上と思ってましたが、主人の身長は167cmです。他のスペックは全部クリアしている人なので、身長なんてどうでもいいとすら思えます。,approved,2025-05-12 20:19:43+00,2001
28153,105154,,自分が大卒なので大卒じゃないと話や考え方が合わないって思ってたけど実際結婚したのは高卒の叩き上げの人。その人と付き合いたくて付き合いたくてめちゃくちゃ頑張った経験を踏まえると、好きになったら学歴なんて微塵も気にならない。,approved,2025-05-12 21:21:04+00,2007
28154,105154,,年収や学歴は妥協できないかなぁ、、,approved,2025-05-12 22:04:59+00,2001
28157,105154,,"年齢は妥協できるかな。
あんまりおじいちゃんでなければ",approved,2025-05-12 22:06:44+00,2002
28158,105154,,年収があるなら、身長は妥協できる。,approved,2025-05-12 22:07:15+00,2004
28160,105154,,学歴低くても、年収稼いでいるならいいでしょ。,approved,2025-05-12 22:07:41+00,2008
28164,105154,,"もうひとつ選択肢に、家系･家柄があると面白いかな。
お堅い家柄とか、逆に貧乏過ぎる家とかだと心配です。",approved,2025-05-12 22:10:03+00,2003
28181,105154,,"うちの夫の身長も170ないですし、学歴も高卒です。
はたからみれば妥協にみえるかもしれません。
でも私の中では妥協したつもりはまったくないです。",approved,2025-05-12 22:20:03+00,2003
28182,105154,,旦那の年収は私の75%くらいしかないですが、わたしが稼ぐので問題ないです！,approved,2025-05-12 22:20:06+00,2009
28205,84152,,続きが気になります。,approved,2025-09-27 05:09:04+00,964
28216,105154,,身長ですね！,approved,2025-05-12 22:32:01+00,
28286,105154,,"趣味はもう、諦めました。
生活には困らないので、ま、いっか、です。",approved,2025-05-12 22:57:11+00,964
28287,105154,,私はルックス。生理的に無理とかでなければ、男前でなくてもそれはそれで、生活するうち、可愛く見えてきます。,approved,2025-05-12 22:58:07+00,
28292,105154,,婚活していた時、お相手の希望年齢を5歳上げたら今の旦那に巡り会いました！,approved,2025-05-12 22:59:29+00,2005
28298,105154,,学歴高いからといって成功するわけでは無いですからね！,approved,2025-05-12 23:02:31+00,2001
28302,105154,,そうそう！社会に出たら勉強してきたことなんて役には立たないから,approved,2025-05-12 23:03:54+00,2002
28330,83203,,それぞれの家庭の形があるのだから、余計なお世話かと。,approved,2025-09-11 01:42:12+00,2001
28340,105154,,ルックスじゃないですか？年取ればカッコいいもブサイクもないですよ。,approved,2025-05-12 23:19:45+00,2009
28346,84404,,相手に彼女とかがいないのならアリです！,approved,2025-10-06 05:11:42+00,2002
28349,102357,,初めてのデートなら払って欲しいです！,approved,2025-05-12 23:23:42+00,
28374,83726,,夫婦の問題なので、言わないです,approved,2025-09-21 01:35:48+00,
28376,84404,,諦められないなら、するべき！,approved,2025-10-06 05:11:42+00,2007
28380,81181,,やっぱり心配するよね。,approved,2025-05-12 23:46:27+00,
28391,102365,,私もまだまだイケる！と思う。,approved,2025-05-13 00:07:31+00,964
28396,105047,,500万円は欲しいですね・・・,approved,2025-05-13 00:11:44+00,2009
28415,105154,,趣味なんて同じじゃなくていいし、それぞれの趣味を楽しめばいいだけだから問題なし。,approved,2025-05-13 00:22:35+00,2006
28421,102365,,やっぱり嬉しいけどちょっと怖いかも。,approved,2025-05-13 00:26:57+00,2009
28467,102365,,嬉しい反面、軽そうな女に見られたのか？と思う,approved,2025-05-13 02:57:27+00,2010
28520,102365,,"内心嬉しい
ほぼされたことないけど",approved,2025-05-13 07:45:54+00,2005
28522,102365,,ナンパするような人は嫌いです...しかし内心嬉しいです。,approved,2025-05-13 07:47:17+00,964
28527,105047,,共働きでも600は欲しいです。子育ても含めて余裕のある生活をしたいので。,approved,2025-05-13 07:49:55+00,2010
28532,104809,,性格。穏やかな人がいいな,approved,2025-05-13 07:55:03+00,2007
28561,102365,,2！！内心嬉しいですが、でもついては行かないです。,approved,2025-05-13 09:02:25+00,2008
28565,102365,,仮にイケメンでもうざいです。,approved,2025-05-13 09:51:25+00,2010
28571,102365,,普通にちょっと嬉しいです！もはや誰からも褒められることや誘われることもない身なので。,approved,2025-05-13 10:04:15+00,
28572,102365,,"断った時に、ふざけんなよブス！！って大声で怒鳴られたことがあるので怖いです。
みじめだし、悔しくて、その日は一日楽しめませんでした。",approved,2025-05-13 10:07:10+00,2007
28576,104809,,お金と優しさ,approved,2025-05-13 10:15:23+00,2006
28581,102365,,ナンパされたらうれしいけど、話を聞くと怪しいビジネスだったり夜のお店の勧誘が多いので基本無視します。,approved,2025-05-13 10:21:53+00,2003
28587,104788,,"結婚前提ならすぐしちゃう。。
数か月してから身体の相性が合わなくて別れると笑えない。。",approved,2025-05-13 10:28:33+00,2002
28589,105047,,"400～500万くらいですかね。
500万以上って現代じゃ難しいと思う。",approved,2025-05-13 10:29:44+00,2006
28617,105154,,"ルックスですね。
趣味だけは妥協できなかった。話が合わないと亀裂の原因。",approved,2025-05-13 10:44:03+00,2004
28626,104990,,自分の話しかしない、否定的な話をする人。,approved,2025-05-13 10:49:37+00,2003
28781,82902,,"知り合いでネットで知り合って結婚した人がいますよ
結婚は、相手をしっかり見極めてからで良いと思います＾＾",approved,2025-12-01 01:37:50+00,2001
28785,105047,,"自分がめちゃくちゃお金使うからわざわざ結婚するなら1200万くらいですかね・・
自分の年収の倍とは言わないけど、結婚したら会社辞めたいので。
共働きなら自分と同額年収700万あればよいです！",approved,2025-05-13 13:42:01+00,2009
28967,104990,,"店員さんに横柄な態度とる人は絶対嫌ですけど
注文時にボソボソちっちゃい声で注文したりするのも嫌ですね。
普通にできないのかなって",approved,2025-05-13 18:08:51+00,
28986,105047,,"&gt;&gt;10 
マジ言ってるの？どんな職業されてるんですか？",approved,2025-05-13 18:42:24+00,
28992,104990,,"満員電車で痴漢をさせて欲しいと、衝撃のお願いをされたことがありました。
もちろんドン引きして別れたし、一時はそんなやつを好きだった自分が情けなくなりました。もちろん何年も連絡をとっていないですが、被害者が出ていないか心配です。",approved,2025-05-13 18:46:24+00,
29005,83726,,夫婦の問題ですから、黙っておくのがベストかと…,approved,2025-09-21 01:35:48+00,2002
29012,83726,,余計なお世話ばかり焼いてると老けて見えちゃいますよ,approved,2025-09-21 01:35:48+00,2005
29013,105154,,"年上が良かったけど年下男性と結婚しました。
人間年齢ではなかったなと感じます。",approved,2025-05-13 20:17:43+00,2006
29015,105154,,趣味は妥協できます。旦那と趣味は全く合いませんがなんだかんだうまくいってます。,approved,2025-05-13 20:40:50+00,2004
29028,105154,,"妥協というのは特に考えなかったです。
好きになったら性格以外はどれも些細というか、気にならないです。",approved,2025-05-13 21:36:16+00,2010
29031,105047,,"年収高くて若い人って一握りですよね
年収基準にすると結婚のハードルが高くなってしまいそう
400くらいはほしいけど・・",approved,2025-05-13 21:48:30+00,2002
29040,105154,,身長です。夫は私よりも低いです。歴代彼氏も低い方が多かった。,approved,2025-05-13 22:16:29+00,2004
29042,82902,,けっこういますよね！気にしなくていいと思います。,approved,2025-12-01 01:37:50+00,
29061,82902,,私たち夫婦は、出会い系サイトで知り合って結婚しました。きっかけは何でもいいと思いますよ！,approved,2025-12-01 01:37:50+00,
29151,82902,,"ネットで出会った方と一緒に登山をして、結婚した友人がいます。
幸せなご家庭を築いているようです。",approved,2025-12-01 01:37:50+00,
29154,105154,,"妥協というほどでもないですが、学歴はまったく気にしませんでした。
夫はたいして優秀でない学校の同窓生、同レベルで話が合います。",approved,2025-05-14 00:26:59+00,2005
29155,104990,,タバコくさい人、物言いがきつい人は無理かなと思います。,approved,2025-05-14 00:29:05+00,2006
29158,104990,,人に偉そうな態度をとる男,approved,2025-05-14 02:07:51+00,
29159,104990,,"&gt;&gt;19 
ヤバすぎ",approved,2025-05-14 02:27:44+00,
29160,105154,,身長はどうでもいいや,approved,2025-05-14 02:35:34+00,2006
29208,84152,,これはストーリーなのか事実なのか。,approved,2025-09-27 05:09:04+00,2003
29219,104788,,付き合って初日でも、OKなのが大半なんだ。へえ。,approved,2025-05-15 23:21:16+00,2006
29228,104990,,"ラインでさり気なく体調不良を伝えても何の気遣いなく他の
返信に答えてくるのと飲食店のメニューをサッと取って自分だけ
見ながら何にします❓ってアホなこと言う男（ヤツ）💨
最低限の気遣いは欲しいですね★",approved,2025-05-16 10:15:33+00,2004
29241,105154,,学歴,approved,2025-05-17 05:43:38+00,2001
29247,105360,,"学歴は気にしません
性格重視です",approved,2025-05-18 15:25:22+00,2008
29253,105154,,"ルックスと学歴ですね＾＾
歳を取ったら、経験が顔ににじみ出ます",approved,2025-05-18 15:30:53+00,2007
29256,102365,,断りながらも内心は嬉しいですね＾＾,approved,2025-05-18 15:33:15+00,
29280,102365,,"久しくされたことがないので、
年甲斐もなくちょっと嬉しいかもしれません。",approved,2025-05-18 15:41:41+00,2003
29288,105351,,"テクニックよりも、一緒にいる時に安心感だと思います。
数をこなすよりも、一人の人と長い時間かけて恋愛関係を育てて来たなんてとても素敵だと思います。お幸せに！",approved,2025-05-18 15:43:26+00,964
29303,105360,,"学歴よりも、その人が今どれだけの経済力があるのかを重視します。
学歴が良くても、とんでもないクズいますから。",approved,2025-05-18 15:47:44+00,2007
29318,102365,,嬉しいですけど着いて行かないですw,approved,2025-05-18 15:53:40+00,2006
29340,105360,,人間として賢くて優しい人が一番だと思います。,approved,2025-05-18 16:04:13+00,2008
29341,105154,,体の相性。性格でカバーできる。,approved,2025-05-18 16:04:36+00,2008
29348,105154,,身長！,approved,2025-05-18 16:07:52+00,2010
29400,105351,,痛くないこと。物足りなくないこと。,approved,2025-05-18 16:29:43+00,2002
29750,105351,,時間が長すぎないけど短すぎない程よい人かな,approved,2025-05-18 20:16:09+00,2008
51114,110723,,せっかくデートするなら他の所に行きたいな。,approved,2025-08-21 00:02:10+00,2005
29431,104809,,もう少し若い時は性格やルックスを重視していましたが、今は年収です。世の中お金で解決できることも多いので･･･,approved,2025-05-18 16:38:42+00,2001
29459,105351,,セックスをしてお互いに気持ちいいと思えるか、幸福感があるかだと思います。,approved,2025-05-18 16:47:47+00,2004
29478,105360,,有名大学を出ているからといって人間として優れているわけではないからね。,approved,2025-05-18 16:54:44+00,2010
29491,105351,,いかせてくれる相手とは相性がいいんだと思う,approved,2025-05-18 16:57:43+00,2010
29515,105360,,"一応、自分も国立大学卒なので
同レベルの方の方が話が合うので良いかな。
レベルが違いすぎると、単語1つ1つ説明しないといけないので
イライラしてしまいます。",approved,2025-05-18 17:08:04+00,964
29540,105154,,ルックス！,approved,2025-05-18 17:14:33+00,964
29595,105360,,学歴よりも現在の経済力と性格重視,approved,2025-05-18 17:33:07+00,2005
29597,81181,,嫌ですよね。もし行ったとしても、私には絶対にバレないようにして欲しい。そしてその秘密をお墓の中まで持って行って！,approved,2025-05-18 17:34:01+00,2010
29624,105154,,"一般的な趣味なら問題がないけど、
ルックスや年収は妥協できなかった。",approved,2025-05-18 17:45:19+00,2006
29684,105351,,トータルでお互いに満足できること,approved,2025-05-18 18:59:14+00,2004
29776,105360,,私も大学行ってるので、大卒の人がいいかな！,approved,2025-05-18 20:37:37+00,964
29799,105360,,学歴は気にしません！安定して職業と自分と価値観があればそれで良いです！,approved,2025-05-18 20:44:02+00,2003
57484,83588,,あるある！ハート柄のパジャマ,approved,2025-12-16 19:04:24+00,2006
29833,83726,,その方の人生を壊してしまうので言わないと思います。,approved,2025-09-21 01:35:48+00,2004
29844,83726,,言わないと思います。,approved,2025-09-21 01:35:48+00,2003
29845,104990,,洋服の匂いが生乾きのような気になる人,approved,2025-05-18 21:04:34+00,2009
29849,104990,,不潔・食べ方が汚い,approved,2025-05-18 21:06:57+00,2010
29860,104990,,無理を強いる人。自分の思い通りに持っていこうとする人。要するに、身勝手な人、しかもそれに気づいていなくて、正当化しちゃう人！そう言う人に限って横柄ですよね。,approved,2025-05-18 21:12:01+00,2003
29905,102072,,"年齢にもよりますよね。
学生ならありでも社会人ならありえない。",approved,2025-05-18 21:43:58+00,2008
29915,102072,,サイゼリアも最近はお洒落になってるし、広々してて良いと思います！,approved,2025-05-18 22:06:10+00,
29941,104990,,自分のことは棚に上げて偉そうな人、そんな人に限って強い物には服従なんだから！,approved,2025-05-18 22:26:53+00,
29998,105360,,学歴よりもいかに努力してきたかが重要！,approved,2025-05-18 23:15:06+00,
30024,84152,,事実なら……。,approved,2025-09-27 05:09:04+00,2006
30037,104990,,いいわけをよくする人。,approved,2025-05-18 23:53:02+00,
30058,104788,,体の相性悪いとこの先つらいですよ。なるべく早い段階でやるかな。,approved,2025-05-19 00:12:27+00,
30072,84152,,彼は最低。あなたが妊娠でもしたら、彼の人間性が分かると思いますよ。,approved,2025-09-27 05:09:04+00,2002
30076,102072,,年齢によるかな,approved,2025-05-19 00:32:28+00,2008
30095,102072,,"サイゼでもいいじゃないですか？そ～ゆ～のが気になるって事は彼の事本当に好きじゃないんじゃないですか？
男といい店でデートしてる私って素敵でしょ！って周りに思われたいだけ。",approved,2025-05-19 00:48:56+00,
30097,102072,,"ないですね。
自分がお店を選ぶ立場なら、相手に美味しいって喜んでもらいたいし、特別な時間を共有したいので、お店選びには時間をかけます。

そういう手間さえ惜しいのかなと思ってしまうので。",approved,2025-05-19 01:05:48+00,2007
30109,105360,,大学は卒業していて欲しいです。,approved,2025-05-19 01:20:06+00,2007
30111,105391,,"友達ではいますけど、やっぱり大変みたいですよ。
行動起こさないほうがいいと思います。",approved,2025-05-19 01:20:36+00,2009
30112,105391,,&gt;&gt;2 バレないようにお願いします,approved,2025-05-19 01:24:37+00,2010
30114,104990,,1人では何も決められない男です！,approved,2025-05-19 01:32:04+00,2009
30122,104990,,嘘ばかりつく男。,approved,2025-05-19 01:49:12+00,
30125,105391,,私は経験ありませんが、友達にしてる子がいました。その子も「絶対にしない方がいい」と言っていたので、気をつけて下さい。,approved,2025-05-19 01:59:08+00,2002
30132,105391,,会社にはいます,approved,2025-05-19 02:27:17+00,964
30133,104788,,&gt;&gt;15 はーい,approved,2025-05-19 02:27:44+00,2005
30174,105391,,"小学校の子供会にいます。周りは呆れています。
若い子の一度のあやまちならまだしも、いやいやそれでもダメなんだけれども
いい年して、旦那も子供もいて何やってんだかって感じ。",approved,2025-05-19 07:51:46+00,2009
30197,102365,,逃げます！今時ナンパなんて引きます。,approved,2025-05-19 08:08:25+00,2007
30222,105047,,400万はないと厳しいかもです。税金、保険料、払う物、結構ありますよね。,approved,2025-05-19 08:31:04+00,2001
30229,104990,,短気な人。何をするにも忙しくてついていけません。,approved,2025-05-19 08:38:10+00,2009
30260,105351,,"変にいろんな男を知ってるよりも、1人の相手と極めた方が至高のセックスが出来る気がする。もちろんそのためには相手とちゃんと話したりはしなきゃいけないと思うけど。
セックスとかそうゆう話題のことでも隠さず思っていることを言い合える関係がいいパートナーになっていくんじゃないかな。",approved,2025-05-19 09:42:13+00,2003
30275,104788,,真剣に付き合っているならいつでもOKです＾＾,approved,2025-05-19 14:07:06+00,2001
30286,104990,,服装のチェックを細かくしてくる人、少し束縛してるみたいな感じです。,approved,2025-05-19 14:14:48+00,2007
30302,102072,,"有りですね。
まずはデートしてみます",approved,2025-05-19 14:22:35+00,2006
30307,105351,,ぶっちゃけ誰としても気持ちいいもんは気持ちから、したいタイミングやセックスの時間、セックスへの考え方とか、そのへんの価値観や好みだと思う。,approved,2025-05-19 14:26:19+00,2001
30308,104990,,匂いがきつい人は無理です。,approved,2025-05-19 14:26:35+00,2006
30310,102365,,うっとおしいふりするけど、内心かなり嬉しい（笑）,approved,2025-05-19 14:27:26+00,2007
30313,105391,,"割り切れないなら不倫はするべきじゃないと思う。
好きになってしまったら、絶対に身を引くべき。自分が辛いだけ。",approved,2025-05-19 14:28:22+00,2009
30315,102365,,それは嬉しいよね,approved,2025-05-19 14:29:27+00,2007
30318,105391,,やめたほうがいい,approved,2025-05-19 14:30:28+00,2009
30328,105391,,昔経験したことがあります。絶対に辞めた方が良いです。結婚して幸せな家庭を築きたいのであれば絶対に辞めた方が良いです。抜け出せなくなり婚期を逃します。。,approved,2025-05-19 14:33:22+00,2004
30343,102365,,怖いと思います。見ず知らずの人に話しかけられるのにとても抵抗があるので...,approved,2025-05-19 14:41:08+00,
30355,105360,,学歴よりも人間生活がきちんとできる人が良いです。,approved,2025-05-19 14:47:12+00,2009
30360,84152,,きゃーー！ドラマや小説みたいな話ですね！,approved,2025-09-27 05:09:04+00,2010
30361,105154,,年齢は外見的に若かったら関係ないと思いました,approved,2025-05-19 14:49:32+00,2006
30364,105360,,"私は国立大卒、旦那は中卒です。学歴は気にしない…と言いつつ、結構話が通じない、考えが合わない、ありますね。
そこをすり合わせてでも一緒にいたいと思えないなら、同じ程度の学歴の人がいいかと思います。",approved,2025-05-19 14:51:24+00,2010
30375,105391,,"された側ですが、相手の女性も「行動を起こすつもりはなかった」と弁解していました。
最初はみんなそう言うんですよ。",approved,2025-05-19 14:55:43+00,2009
30380,82902,,"なにがダメなのかわからない！
出会いはどうあれ、互いに好きならいいんじゃなーい",approved,2025-12-01 01:37:50+00,2007
30395,105391,,友達が10年以上していますが何も言えません。,approved,2025-05-19 15:10:36+00,2007
30400,82902,,有りだと思います。ネットでも、お見合いでも何でも気持ちがあれば良いと思います。,approved,2025-12-01 01:37:50+00,2005
30457,105351,,お気持ちよくわかります。彼以外のひとを知ることで、彼の良さに改めて気づけるかもしれませんね。,approved,2025-05-19 15:37:02+00,2006
36417,102365,,その人の顔や話し方次第で、気分は変わると思います。,approved,2025-06-05 14:28:51+00,
30488,82902,,ありです！,approved,2025-12-01 01:37:50+00,
30495,104990,,人として薄っぺらいやつ,approved,2025-05-19 15:48:05+00,2003
30496,84152,,ドラマの世界みたいですね！,approved,2025-09-27 05:09:04+00,2006
30498,104990,,私もそれ無理です。あと、お金にケチな姿。,approved,2025-05-19 15:49:23+00,2005
30514,105360,,気にしません。稼ぐ力さえあればいい。,approved,2025-05-19 15:52:41+00,2004
30560,105360,,"高校卒業してればそれでいいですね。高校ももちろんどこでも構いません。
あとはやっぱり性格ですね。",approved,2025-05-19 16:02:19+00,2008
30575,82902,,今の時代、そんなに珍しいこともないでしょう,approved,2025-12-01 01:37:50+00,2005
30593,104788,,お互いの信念とか宗教感も関係してくるから、色々だと思います。,approved,2025-05-19 16:16:22+00,2006
30599,105391,,最終ろくなことにはならないですよ,approved,2025-05-19 16:19:38+00,2001
30605,105391,,過去ですが、してました。つらいですよ。,approved,2025-05-19 16:21:17+00,2009
30613,105351,,お互いが気持ちよく安心感があれば十分ですね。,approved,2025-05-19 16:23:01+00,2009
30617,104788,,体の相性を気にしないのであれば、結婚してからでいいのでは？,approved,2025-05-19 16:24:03+00,2005
30620,104788,,そういう雰囲気になればいつでもOK,approved,2025-05-19 16:24:45+00,2008
30622,104788,,付き合っているなら大丈夫だと思いますが、お互いの気持ち次第ですね。,approved,2025-05-19 16:26:04+00,2008
